<?xml version="1.0"?>
<soluzione xmlns:xs="http://www.w3.org/2001/XMLSchema-instance" xs:schemaLocation="../../../xml/schema/soluzione.xsd">
  <proposta> Rendere pubbliche tutte le attività degli uffici amministrativi e della Giunta, pubblicandole sul sito Internet del Comune, riassumendole in una pubblicazione cartacea mensile, istituendo uno sportello informativo presso il municipio. In particolare le riunioni della Giunta saranno precedute dalla pubblicazione dell'Ordine del Giorno, trasmesse in videoconferenza accessibile a tutti, registrate e rese sempre disponibili sul sito ufficiale del Comune.
  </proposta>
<pro> Chiunque potrà controllare l'operato dell'amministrazione e segnalare eventuali irregolarità ed errori </pro>
<pro>Gli amministratori, sentendosi controllati, faranno del loro meglio per agire equamente, correttamente, efficientemente</pro>
<pro>La possibilità di informarsi approfonditamente stimolerà l'interesse di alcuni cittadini verso l'attività amministrativa, diffonderà la conoscenza e formerà nuovi potenziali amministratori preparati che garantiranno il ricambio negli anni a venire.</pro>
<pro>Qualora gli amministratori si rifiutassero di aderire a questa proposta si potrebbe legittimamente pensare che stiano operando in mala fede </pro>

<contro>Per gestire il sito e lo sportello sarà necessario impiegare almeno una persona a tempo pieno</contro>
<contro>La pubblicazione cartacea mensile ha un costo di stampa e distribuzione, ma è necessaria perlomeno finché l'uso della rete Internet non si sarà diffuso maggiormente.</contro>

  <domanda>
    <testo>Secondo te è possibile rimuovere le sostanze nocive durante il trattamento di trasformazione in compost?</testo>
    <opzione>
      <descrizione>Sì</descrizione>
      <nvoti>2</nvoti>
    </opzione>
    <opzione>
      <descrizione>No</descrizione>
      <nvoti>6</nvoti>
    </opzione>
    <opzione>
      <descrizione>Forse sì, ma non mi fiderei comunque a utilizzare il compost in agricoltura biologica</descrizione>
      <nvoti>4</nvoti>
    </opzione>
  </domanda>
</soluzione>
