<?xml version="1.0"?>
<soluzione xmlns:xs="http://www.w3.org/2001/XMLSchema-instance" xs:schemaLocation="../../../xml/schema/soluzione.xsd">
  <proposta> Si fanno delle "bubarate" direttamente sui campi  </proposta>
<pro> sono belli da vedere all'epifania. </pro>
<pro> Abbiamo sempre fatto così, "vuttu farme far che po' ti ades?" </pro>
<contro>La legge (citare quale) non lo permette o presto non lo permetterà</contro>
<contro>contributo negativo alla qualità dell'aria che questi incendi provocano</contro>
<contro>emettendo negli strati più bassi dell'atmosfera quantità elevate di fumi difficilmente disperdibili con le nostre condizioni meteorologiche invernali;</contro>
<contro>i costi di gestione sono maggiori rispetto alla trinciatura.</contro>
<contro>Spreco inutile di materiale energetico.</contro>

  <domanda>
    <testo>Secondo te è possibile rimuovere le sostanze nocive durante il trattamento di trasformazione in compost?</testo>
    <opzione>
      <descrizione>Sì</descrizione>
      <nvoti>2</nvoti>
    </opzione>
    <opzione>
      <descrizione>No</descrizione>
      <nvoti>6</nvoti>
    </opzione>
    <opzione>
      <descrizione>Forse sì, ma non mi fiderei comunque a utilizzare il compost in agricoltura biologica</descrizione>
      <nvoti>4</nvoti>
    </opzione>
  </domanda>
</soluzione>
